{"$schema":"https://json-schema.org/draft/2020-12/schema","$id":"https://xextigre.github.io/roblox-3d-contract-brain/schemas/enhanced_evidence_contract.schema.json","title":"Enhanced Roblox 3D Evidence Contract","type":"object","additionalProperties":false,"required":["schema_version","artifact","topology","texture","uv","multiview","internal_policy","external_gates","evidence","review","decision"],"properties":{"schema_version":{"const":"1.0.0"},"artifact":{"type":"object","additionalProperties":false,"required":["path","sha256"],"properties":{"path":{"type":"string","minLength":1},"sha256":{"$ref":"#/$defs/sha256"}}},"topology":{"type":"object","additionalProperties":false,"required":["physical_boundary_edges","physical_nonmanifold_edges","degenerate_triangles","duplicate_face_groups"],"properties":{"physical_boundary_edges":{"type":"integer","minimum":0},"physical_nonmanifold_edges":{"type":"integer","minimum":0},"degenerate_triangles":{"type":"integer","minimum":0},"duplicate_face_groups":{"type":"integer","minimum":0}}},"texture":{"type":"object","additionalProperties":false,"required":["embedded_image_byte_exact"],"properties":{"embedded_image_byte_exact":{"type":"boolean"}}},"uv":{"type":"object","additionalProperties":false,"required":["uv_outside_0_1_count","exact_nonzero_overlap_pairs","exact_overlap_area","exact_overlap_tolerance_area","raster_multi_coverage_ratio_including_shared_edges"],"properties":{"uv_outside_0_1_count":{"type":"integer","minimum":0},"exact_nonzero_overlap_pairs":{"type":"integer","minimum":0},"exact_overlap_area":{"type":"number","minimum":0},"exact_overlap_tolerance_area":{"type":"number","exclusiveMinimum":0},"raster_multi_coverage_ratio_including_shared_edges":{"type":"number","minimum":0}}},"multiview":{"type":"object","additionalProperties":false,"required":["views","summary"],"properties":{"views":{"type":"array","minItems":62,"maxItems":62,"items":{"type":"object","additionalProperties":false,"required":["yaw","pitch","silhouette_iou","evidence_ids"],"properties":{"yaw":{"type":"integer","minimum":0,"maximum":330,"multipleOf":30},"pitch":{"enum":[-90,-60,-30,0,30,60,90]},"silhouette_iou":{"type":"number","minimum":0,"maximum":1},"evidence_ids":{"type":"array","minItems":1,"uniqueItems":true,"items":{"type":"string","minLength":1}}}}},"summary":{"type":"object","additionalProperties":false,"required":["silhouette_iou_min","ssim_min"],"properties":{"silhouette_iou_min":{"type":"number","minimum":0,"maximum":1},"ssim_min":{"type":"number","minimum":0,"maximum":1}}}}},"internal_policy":{"type":"object","additionalProperties":false,"required":["silhouette_iou_min","ssim_min"],"properties":{"silhouette_iou_min":{"type":"number","minimum":0,"maximum":1},"ssim_min":{"type":"number","minimum":0,"maximum":1}}},"external_gates":{"type":"object","additionalProperties":false,"required":["khronos_gltf_validator","blender_import_reopen","roblox_avatar_setup","roblox_studio_playtest","ugc_validation"],"properties":{"khronos_gltf_validator":{"$ref":"#/$defs/gate"},"blender_import_reopen":{"$ref":"#/$defs/gate"},"roblox_avatar_setup":{"$ref":"#/$defs/gate"},"roblox_studio_playtest":{"$ref":"#/$defs/gate"},"ugc_validation":{"$ref":"#/$defs/gate"}}},"evidence":{"type":"array","minItems":1,"items":{"type":"object","additionalProperties":false,"required":["evidence_id","path","sha256","artifact_sha256"],"properties":{"evidence_id":{"type":"string","minLength":1},"path":{"type":"string","minLength":1},"sha256":{"$ref":"#/$defs/sha256"},"artifact_sha256":{"$ref":"#/$defs/sha256"}}}},"review":{"type":"object","additionalProperties":false,"required":["generator_id","validator_id","reviewer_id"],"properties":{"generator_id":{"type":"string","minLength":1},"validator_id":{"type":"string","minLength":1},"reviewer_id":{"type":"string","minLength":1}}},"decision":{"type":"object","additionalProperties":false,"required":["release_eligible","manual_override"],"properties":{"release_eligible":{"type":"boolean"},"manual_override":{"const":false}}}},"$defs":{"sha256":{"type":"string","pattern":"^[a-f0-9]{64}$"},"gate":{"enum":["PASS","FAIL","BLOCKED","NOT_RUN"]}}}