{"schema_version":"1.0.0","artifact":{"path":"RBX_ANIME_DOLL_AVATAR_SETUP_SAFE_REPAIR_V2.glb","sha256":"b551a526e6d613132fb6b5dd2ae3a6c0cf4ff44a980a31c00906fcadc976a142"},"topology":{"physical_boundary_edges":0,"physical_nonmanifold_edges":0,"degenerate_triangles":0,"duplicate_face_groups":0},"texture":{"embedded_image_byte_exact":true},"uv":{"uv_outside_0_1_count":0,"exact_nonzero_overlap_pairs":0,"exact_overlap_area":0.0,"exact_overlap_tolerance_area":1e-12,"raster_multi_coverage_ratio_including_shared_edges":0.1985582899665064},"multiview":{"views":[{"yaw":0,"pitch":-60,"silhouette_iou":1.0,"evidence_ids":["proof-62"]},{"yaw":30,"pitch":-60,"silhouette_iou":0.9997379317574296,"evidence_ids":["proof-62"]},{"yaw":60,"pitch":-60,"silhouette_iou":0.9993660353435296,"evidence_ids":["proof-62"]},{"yaw":90,"pitch":-60,"silhouette_iou":0.9995113847356591,"evidence_ids":["proof-62"]},{"yaw":120,"pitch":-60,"silhouette_iou":0.999363715899149,"evidence_ids":["proof-62"]},{"yaw":150,"pitch":-60,"silhouette_iou":1.0,"evidence_ids":["proof-62"]},{"yaw":180,"pitch":-60,"silhouette_iou":1.0,"evidence_ids":["proof-62"]},{"yaw":210,"pitch":-60,"silhouette_iou":1.0,"evidence_ids":["proof-62"]},{"yaw":240,"pitch":-60,"silhouette_iou":0.999448558374035,"evidence_ids":["proof-62"]},{"yaw":270,"pitch":-60,"silhouette_iou":0.9995101880877743,"evidence_ids":["proof-62"]},{"yaw":300,"pitch":-60,"silhouette_iou":0.9994510234491413,"evidence_ids":["proof-62"]},{"yaw":330,"pitch":-60,"silhouette_iou":0.9996360989810772,"evidence_ids":["proof-62"]},{"yaw":0,"pitch":-30,"silhouette_iou":1.0,"evidence_ids":["proof-62"]},{"yaw":30,"pitch":-30,"silhouette_iou":0.9991340991745079,"evidence_ids":["proof-62"]},{"yaw":60,"pitch":-30,"silhouette_iou":0.99858934169279,"evidence_ids":["proof-62"]},{"yaw":90,"pitch":-30,"silhouette_iou":1.0,"evidence_ids":["proof-62"]},{"yaw":120,"pitch":-30,"silhouette_iou":0.999304535970945,"evidence_ids":["proof-62"]},{"yaw":150,"pitch":-30,"silhouette_iou":0.9996648793565683,"evidence_ids":["proof-62"]},{"yaw":180,"pitch":-30,"silhouette_iou":1.0,"evidence_ids":["proof-62"]},{"yaw":210,"pitch":-30,"silhouette_iou":0.9997766361402725,"evidence_ids":["proof-62"]},{"yaw":240,"pitch":-30,"silhouette_iou":0.9993865030674847,"evidence_ids":["proof-62"]},{"yaw":270,"pitch":-30,"silhouette_iou":1.0,"evidence_ids":["proof-62"]},{"yaw":300,"pitch":-30,"silhouette_iou":0.9993759263593104,"evidence_ids":["proof-62"]},{"yaw":330,"pitch":-30,"silhouette_iou":0.9992576095025983,"evidence_ids":["proof-62"]},{"yaw":0,"pitch":0,"silhouette_iou":0.9997245305541527,"evidence_ids":["proof-62"]},{"yaw":30,"pitch":0,"silhouette_iou":0.9989477536828621,"evidence_ids":["proof-62"]},{"yaw":60,"pitch":0,"silhouette_iou":0.9976364659538548,"evidence_ids":["proof-62"]},{"yaw":90,"pitch":0,"silhouette_iou":0.9957623730710802,"evidence_ids":["proof-62"]},{"yaw":120,"pitch":0,"silhouette_iou":0.9980265012686778,"evidence_ids":["proof-62"]},{"yaw":150,"pitch":0,"silhouette_iou":0.998951351844253,"evidence_ids":["proof-62"]},{"yaw":180,"pitch":0,"silhouette_iou":0.9997245305541527,"evidence_ids":["proof-62"]},{"yaw":210,"pitch":0,"silhouette_iou":0.9989477536828621,"evidence_ids":["proof-62"]},{"yaw":240,"pitch":0,"silhouette_iou":0.9976364659538548,"evidence_ids":["proof-62"]},{"yaw":270,"pitch":0,"silhouette_iou":0.9957623730710802,"evidence_ids":["proof-62"]},{"yaw":300,"pitch":0,"silhouette_iou":0.9980265012686778,"evidence_ids":["proof-62"]},{"yaw":330,"pitch":0,"silhouette_iou":0.998951351844253,"evidence_ids":["proof-62"]},{"yaw":0,"pitch":30,"silhouette_iou":1.0,"evidence_ids":["proof-62"]},{"yaw":30,"pitch":30,"silhouette_iou":0.9997766361402725,"evidence_ids":["proof-62"]},{"yaw":60,"pitch":30,"silhouette_iou":0.9993865030674847,"evidence_ids":["proof-62"]},{"yaw":90,"pitch":30,"silhouette_iou":1.0,"evidence_ids":["proof-62"]},{"yaw":120,"pitch":30,"silhouette_iou":0.9993759263593104,"evidence_ids":["proof-62"]},{"yaw":150,"pitch":30,"silhouette_iou":0.9992576095025983,"evidence_ids":["proof-62"]},{"yaw":180,"pitch":30,"silhouette_iou":1.0,"evidence_ids":["proof-62"]},{"yaw":210,"pitch":30,"silhouette_iou":0.9991340991745079,"evidence_ids":["proof-62"]},{"yaw":240,"pitch":30,"silhouette_iou":0.99858934169279,"evidence_ids":["proof-62"]},{"yaw":270,"pitch":30,"silhouette_iou":1.0,"evidence_ids":["proof-62"]},{"yaw":300,"pitch":30,"silhouette_iou":0.999304535970945,"evidence_ids":["proof-62"]},{"yaw":330,"pitch":30,"silhouette_iou":0.9996648793565683,"evidence_ids":["proof-62"]},{"yaw":0,"pitch":60,"silhouette_iou":1.0,"evidence_ids":["proof-62"]},{"yaw":30,"pitch":60,"silhouette_iou":1.0,"evidence_ids":["proof-62"]},{"yaw":60,"pitch":60,"silhouette_iou":0.999448558374035,"evidence_ids":["proof-62"]},{"yaw":90,"pitch":60,"silhouette_iou":0.9995101880877743,"evidence_ids":["proof-62"]},{"yaw":120,"pitch":60,"silhouette_iou":0.9994510234491413,"evidence_ids":["proof-62"]},{"yaw":150,"pitch":60,"silhouette_iou":0.9996360989810772,"evidence_ids":["proof-62"]},{"yaw":180,"pitch":60,"silhouette_iou":1.0,"evidence_ids":["proof-62"]},{"yaw":210,"pitch":60,"silhouette_iou":0.9997379317574296,"evidence_ids":["proof-62"]},{"yaw":240,"pitch":60,"silhouette_iou":0.9993660353435296,"evidence_ids":["proof-62"]},{"yaw":270,"pitch":60,"silhouette_iou":0.9995113847356591,"evidence_ids":["proof-62"]},{"yaw":300,"pitch":60,"silhouette_iou":0.999363715899149,"evidence_ids":["proof-62"]},{"yaw":330,"pitch":60,"silhouette_iou":1.0,"evidence_ids":["proof-62"]},{"yaw":0,"pitch":90,"silhouette_iou":1.0,"evidence_ids":["proof-62"]},{"yaw":0,"pitch":-90,"silhouette_iou":1.0,"evidence_ids":["proof-62"]}],"summary":{"silhouette_iou_min":0.9957623730710802,"ssim_min":0.979928097813156}},"internal_policy":{"silhouette_iou_min":0.995,"ssim_min":0.95},"external_gates":{"khronos_gltf_validator":"NOT_RUN","blender_import_reopen":"NOT_RUN","roblox_avatar_setup":"NOT_RUN","roblox_studio_playtest":"NOT_RUN","ugc_validation":"NOT_RUN"},"evidence":[{"evidence_id":"proof-62","path":"renders/PROOF_62_VIEWS.png","sha256":"632342a5ab2d3d04e89a1d07aa169a8679575edce3fe5a1da389b9c8b05a286c","artifact_sha256":"b551a526e6d613132fb6b5dd2ae3a6c0cf4ff44a980a31c00906fcadc976a142"}],"review":{"generator_id":"safe-repair-generator-v2","validator_id":"enhanced-evidence-gate-v1","reviewer_id":"independent-review-v3"},"decision":{"release_eligible":false,"manual_override":false}}